uuid,name,type,permalink,cb_url,rank,created_at,updated_at,short_description,started_on,ended_on,event_url,registration_url,venue_name,description,country_code,state_code,region,city,logo_url,event_roles
f71f77a8-17fa-c726-7922-6a17d6b59697,36|86 Southeastern Entrepreneurship Conference,event,36-86-201568,https://www.crunchbase.com/event/36-86-201568,6409.0,2015-01-20 21:47:57,2018-02-13 01:14:19,"Bringing southern thinkers, founders and investors together by hosting an annual event in Nashville",2015-06-08,2015-06-10,http://thirtysixeightysix.com/,http://www.eventbrite.com/e/3686-tickets-14891168887,Marathon Music Works,"The mission of 36|86 is to bring southern thinkers, founders and investors together by hosting an annual event in Nashville and inviting a national audience to participate in the experience. This event gathers incredible startup businesses, proven business leaders and strategic investors for a celebration of entrepreneurship and southern culture. Ultimately, this event becomes a platform connecting the “doers,” the “makers,” and the “innovators” in the southeast, around the country, and across the globe.",USA,TN,Tennessee,Nashville,"https://crunchbase-production-res.cloudinary.com/image/upload/c_lpad,h_120,w_120,f_jpg/v1422164356/egyeejzs4havhorapie7.jpg","competition,conference,festival,meetup,networking"
cdd7dbec-96d8-2cda-6405-861788a39873,Tech Inclusion Conference 2017,event,tech-inclusion-conference-2017-20171017,https://www.crunchbase.com/event/tech-inclusion-conference-2017-20171017,14437.0,2017-09-27 04:21:22,2018-02-13 00:02:42,Tech Inclusion Conference 2017 at the most exciting multi-purpose event space in San Francisco.,2017-10-17,2017-10-19,https://sf17.techinclusion.co/home,https://sf17.techinclusion.co/home,The Armory,The Tech Inclusion Career Fair connects companies of all shapes and sizes to a more diverse talent pool. We invite you to join us and be recognized as a leader in the growing commitment to build inclusive and diverse teams. Companies looking to hire an inclusive workforce contact us to learn more how to participate in the career fair.,USA,CA,California,San Francisco,"https://crunchbase-production-res.cloudinary.com/image/upload/c_lpad,h_120,w_120,f_jpg/v1506485952/bwl1fgqkmcckznghkhng.png",other
ffe855e2-43a9-4944-803e-35cc5041789d,Data Storytelling in Excel: Soar out of the Debris,event,data-storytelling-in-excel-soar-out-of-the-debris,https://www.crunchbase.com/event/data-storytelling-in-excel-soar-out-of-the-debris,14617.0,2018-03-28 01:15:53,2018-03-28 01:31:32,In this workshop we will interpret data and summarise its meaning into...,2018-05-01,2018-05-01,,https://go.evvnt.com/213616-0?pid=5396,Novotel Manchester Centre Hotel,"<p>In this workshop we will interpret data and summarise its meaning into a format that we will each then transform into easy-to-read tables, graphs and infographs using Excel that can be taken home and used again and again.</p> <p>Benefits to your Organisation:<br />- Digest, consolidate, summarise and visualise data<br />- Create dashboard charts and tables using Excel tools<br />- Improve presentations with graphic design and layout<br />- Apply a narrative to infographs using best practises<br />- Consider when to use a chart, table or other graphic display<br />- Know how to use visual effects to improve their reports and presentations</p> <p>Takeaways:<br />1. Excel templates with sample charts, tables and infographics<br />2. During the course, participants will create their own visuals in Excel to take away with them for future reference<br />3. A USB with usable Excel templates of sample charts, tables and infographs</p> <p>Who you are:<br />You are likely to work in any industry where you think quantitative visualisation could help.</p> <p>Facilitator:<br />This workshop's facilitator is Danielle Stein Fairhurst, a passionate subject matter expert on financial modelling and analysis. Author of two books and founder of a training consultancy, she has appeared on Excel TV and several industry podcasts. She set up the Financial Modellers' Meetup group, which now has 5,000+ international members and a 40,000+ member LinkedIn forum.</p> <p>FAQs:<br />What are my transport/parking options for getting to and from the event?<br />30% discount to the price for Q Park Piazza just behind the hotel.</p> <p>What can I bring into the event?<br />Please bring a laptop with Microsoft Excel 2013 or higher (2016) installed and don't forget your charger. If you use a Mac, Mac users will be accommodated for.</p> <p>What's the cancellation...</p> <p><strong>Time:</strong> 8:30 am - 5:00 pm.</p> <p><strong>Category:</strong> Classes / Courses | Professional Training.</p> <p><strong>Artists / Speakers:</strong> Danielle Stein Fairhurst.</p> <p><strong>Prices:</strong><br />Early Bird Rate (before April 1st): GBP 595.00,<br />Standard Rate (after April 1st): GBP 795.00,<br />Corporate Rate: GBP 675.00,<br />Triple Bundle Rate (All 3 Manchester Workshops): GBP 1500.00.</p>",GBR,,Manchester,Manchester,"https://crunchbase-production-res.cloudinary.com/image/upload/c_lpad,h_120,w_120,f_jpg/mfwqgbf6kwhi07r6oatq",class
c4a2c39c-14c7-1838-a989-d7381244cd8e,Worlds Fair Nano,event,worlds-fair-nano-2017128,https://www.crunchbase.com/event/worlds-fair-nano-2017128,4371.0,2016-12-08 05:19:44,2018-02-13 01:14:19,"Worlds Fair Nano is a two-day festival filled with technology, futurist talks, art, music, food, and more.",2017-01-28,2017-01-29,http://worldsfairusa.com/nano/sf/,https://www.ticketfly.com/purchase/event/1385030?utm_medium=bks,Pier 70,"Worlds Fair Nano is a two-day festival filled with technology, futurist talks, art, music, food, and more.  The future of their world is being created every day, in offices, labs, garages, and classrooms. While some talking heads spread fear about what lies ahead, they’ve seen the future and can't wait for it to arrive. Join us for reveal new possibilities on the horizon.  Meet us in the Technology Playground, the closest thing to an adult playground this side of Burning Man, filled with interactive stations specifically designed to let you experience the future. Think virtual reality, drones, motorized skateboards, wearable tech, robotics, IoT, 3D printing, and more. They have over 50 companies coming.   They don't have a crystal ball, but they do have an all-start lineup and Founders and CEOs giving you the future of their country and their world. Titles include The Future of Democracy | The Future of VR v. AR | The Future of Artificial Intelligence | The Future of Art | The Future of Cannabis | The Future of Capitalism | The Future of Cities | The Future of Food | And More!  They’ve hand selected a few incredibly talented Bay Area artists to showcase their work. They’ve got multi-sensory interactive exhibits, live demonstrations and more. Immerse yourself in their world and rediscover your own.  Few areas of engineering are more controversial than food engineering, and for good reason. What they put into their bodies is one of the most intimate decisions they make. And yet, the more they learn about what their body needs, the more effectively they can produce foods that give us what they need to perform at their best.  At Worlds Fair Nano they’re bringing you some future foods that may just revolutionize the way they eat.",USA,CA,California,San Francisco,"https://crunchbase-production-res.cloudinary.com/image/upload/c_lpad,h_120,w_120,f_jpg/v1481174111/qvu6z0uns3il0ks2zqpp.png","conference,expo,festival,meetup,networking,other"
1dd922a7-975a-4956-970d-3c33f4860a5c,"Seed Forum Tallin, Spring 2018",event,seed-forum-tallin,https://www.crunchbase.com/event/seed-forum-tallin,9336.0,2018-04-24 14:46:18,2018-04-24 14:47:44,"Seed Forum is a global organisation with the mission to facilitate access to finance, accelerators to boost global innovation",2018-04-11,2018-04-12,https://www.seedforumtallinn.com/the-event,https://www.seedforumtallinn.com/register,Swedbank HQ,"We look forward to gathering some exciting companies in the heart of Tallinn. All companies have been through the Seed Forum process which guarantees exciting investor-ready company presentations by competent entrepreneurs. The Seed Forum investor matchmaking forums are an efficient half-day forum from morning until lunch, usually with around 6-10 born global company presentations. The companies will firstly present a 30 seconds power pitch followed by maximum 3 key-note speeches. Thereafter the companies will present their 6 or 7 minute investor pitch and their WOW-pitch followed by questions from the investors. In Spring 2018 we have confirmed 3 companies from Ukraine innovating e-commerce sector, 2 companies from Estonia from AI / Machine Learning and education sector and companies from Finland working in business automation.",EST,,Harjumaa,Tallinn,"https://crunchbase-production-res.cloudinary.com/image/upload/c_lpad,h_120,w_120,f_jpg/thofzoo5vzqr70yx6bbe",conference
0425938b-1eac-4f4c-590a-26c426978e56,Startup Weekend Hong Kong,event,startup-weekend-hong-kong-2016415,https://www.crunchbase.com/event/startup-weekend-hong-kong-2016415,3829.0,2016-03-08 06:13:49,2018-02-13 01:14:30,Startup Weekend Hong Kong,2016-04-15,2016-04-17,http://www.up.co/communities/china/hong-kong/startup-weekend/8759,http://www.up.co/communities/china/hong-kong/startup-weekend/8759,,,,,,,"https://crunchbase-production-res.cloudinary.com/image/upload/c_lpad,h_120,w_120,f_jpg/v1457417613/ywmtzhwfksyes0o37umy.png",other
e1b6397d-68f7-42fc-b39b-9263565dc605,Tumml Urban Accelerator Exhibition Day,event,tumml-urban-accelerator-exhibition-day-201456,https://www.crunchbase.com/event/tumml-urban-accelerator-exhibition-day-201456,17248.0,2014-11-11 02:44:43,2018-02-13 01:14:30,Tumml will host its Exhibition Day! There will be a fireside chat with Gavin Newsom and investor Jason Calacanis.,2014-05-06,2014-05-06,,http://www.eventbrite.com/e/the-future-of-urban-innovation-tickets-11028124417,Folsom Street Foundry,,USA,CA,California,San Francisco,"https://crunchbase-production-res.cloudinary.com/image/upload/h_120,w_120,f_jpg/v1507847753/placeholder_zgpxrr.png",conference
bd299615-716b-08b1-b4ce-67820ef591b2,Lift Prototyping Lab,event,lift-prototyping-lab-2016210,https://www.crunchbase.com/event/lift-prototyping-lab-2016210,10204.0,2015-12-26 06:32:37,2018-02-13 01:14:25,"Lift Prototyping Lab for worldwide innovators for 3 memorable days to build the future of your own products, services and business models.",2016-02-10,2016-02-12,http://liftconference.com/lift-prototyping-lab,http://liftconference.com/lift-prototyping-lab/resgistration,CICG - Centre International de Conférences Genève,"Every year, more than 1,000 hail from business, politics, culture and academia to enjoy talks, interactive workshops and special presentations. It’s all about better understanding where their world is going.  This year, they go one step further: they are inviting a select group of participants to take the ideas of Lift16 and build the future of their own products, services and business models. They call it the Lift Prototyping Lab. It’s a space and a program dedicated to make Lift work directly for you.  Running in parallel to the public program, teams of participants will work in company of Lift16 speakers and experts to go from problem to prototype in just three days.  To do that, they designed the format with the team behind the international bestsellers Business Model Generation and Value Proposition Design, and are bringing the latest prototyping tools and techniques inspired by the maker movement dear to all Lifters.  They gathered the best ingredients to help you invent the value of tomorrow.",CHE,,Geneve,Geneva,"https://crunchbase-production-res.cloudinary.com/image/upload/c_lpad,h_120,w_120,f_jpg/v1454329783/gl86r0dxexisnfob6ur6.png","class,hackathon,networking,other"
04defd58-c96d-4262-b3ad-b4f81dc75924,Silicon Valley Forum: Focus on Blockchain,event,silicon-valley-forum-focus-on-blockchain,https://www.crunchbase.com/event/silicon-valley-forum-focus-on-blockchain,3247.0,2018-08-11 19:43:44,2018-08-11 19:43:44,Popular ongoing series invites a handpicked group of six entrepreneurs to pitch their product in front of an audience & panel of judges.,2018-08-09,2018-08-09,https://siliconvalleyforum.com/event/startup-pitch-night-focus-on-blockchain/,https://www.eventbrite.com/e/sold-out-startup-pitch-night-focus-on-blockchain-tickets-46854743800,K&L Gates LLP,"This event is SOLD OUT! Walk-ins will only be permitted if space allows. Get linked up to great startups at our next Startup Pitch Night! Each installment of this popular ongoing series invites a handpicked group of seven entrepreneurs to pitch their product in front of an audience and panel of expert judges. We feature a different tech vertical every time–and this August, you’ll meet an amazing new group of startups who are making great strides in a fast-growing industry: blockchain technology.",USA,CA,California,San Francisco,"https://crunchbase-production-res.cloudinary.com/image/upload/c_lpad,h_120,w_120,f_jpg/jlvvasxovef0bvidfc5a",competition
9853de24-2d2a-6eba-d14b-299ede72983f,CoInvent SF Startup Happy Hour @ Press Club,event,coinvent-sf-startup-happy-hour-press-club-2015720,https://www.crunchbase.com/event/coinvent-sf-startup-happy-hour-press-club-2015720,13722.0,2015-06-26 16:03:40,2018-02-13 01:14:24,"This is a free event for founders, entrepreneurs, investors, and startup professionals - part of the startup networking series.",2015-07-20,2015-07-20,http://coinvent.co/events/pressclub,http://coinvent.co/events/pressclub,Press Club,"This is a free event for founders, entrepreneurs, investors, and startup professionals - part of the startup networking series. Private space. Cash bar. RSVPs required.   Press Club, a wine bar and lounge, offers California’s finest wines and beers in a sophisticated, social atmosphere. Press Club's menu of seasonal small plates and thoughtful pairings offers the ultimate wine experience in one of San Francisco's most notable destinations. Visitors can socialize, taste wine and share small plates in the luxurious wine tasting cellar at the foot of the Four Seasons Hotel.     Note: 1). To attend this event, you must be at least 21. Please show ID when entering the venue. 2). Subscribe to CoInvent’s weekly newsletter for all things startup-related @ www.getcoinvent.com 3). Opt in to get future event alerts in your local area @ www.coinventsf.com",USA,CA,California,San Francisco,"https://crunchbase-production-res.cloudinary.com/image/upload/c_lpad,h_120,w_120,f_jpg/v1435334554/qbrox0d03ffwbrd8fw5w.jpg","demo_day,networking"
c4be1217-e6cd-c397-5fe8-794b346c3f92,Mobile Growth Seattle Meetup @ Redfin,event,mobile-growth-seattle-meetup-redfin-2016630,https://www.crunchbase.com/event/mobile-growth-seattle-meetup-redfin-2016630,7793.0,2016-06-29 18:41:54,2018-02-13 01:14:30,"We're a group of mobile app developers (iOS and Android), mobile startups, and mobile marketers interested in growing our apps.",2016-06-30,2016-06-30,http://www.meetup.com/Mobile-Growth-Seattle/events/227996557/,http://www.meetup.com/Mobile-Growth-Seattle/events/227996557/,Redfin,"We're bringing together a great lineup of experts from Shyft and Staples for our meetup in Seattle. Come meet other likeminded devs and mobile marketers and mobile-first businesses, and hear some awesome strategies for growth on topics like user acquisition, retention, engagement, ASO/SEO, deep linking, converting users from mobile web to native app, and more.  The People Chris Pitchford - Director of Growth, Shyft Gwen Murray - Mobile Marketing Lead, Staples   The Plan 6.30pm Check-in & onsite registration 7.00pm Welcome & Intros 7.15pm Mobile Growth Panel Discussion 7.45pm Q&A from the audience 8.00pm Social hour",USA,WA,Washington,Seattle,"https://crunchbase-production-res.cloudinary.com/image/upload/h_120,w_120,f_jpg/v1507847753/placeholder_zgpxrr.png",meetup
5413dcc5-4884-fc0f-7800-beda5f2191ff,The Future of E-Commerce Delivery 2017,event,the-future-of-e-commerce-delivery-2017-2017104,https://www.crunchbase.com/event/the-future-of-e-commerce-delivery-2017-2017104,5576.0,2017-06-23 10:45:37,2018-02-13 01:14:26,Attend this future facing e-commerce conference to explore the most innovative approaches to customer experience and delivery operations.,2017-10-04,2017-10-04,https://go.evvnt.com/135608-1,https://go.evvnt.com/135608-0,Hilton Tower Bridge,"Against this backdrop, The Future of E-Commerce Delivery returns for a fifth time to explore how partnerships with logistics operators and greater collaboration across the value chain can help to safeguard success. Exploring diverse topics including customer expectations, operational efficiency, urban logistics, cross-border e-commerce, and innovation in both the last mile and fulfilment, the event is not to be missed. Plus, with over 170 senior executives from across the continent regularly attending, be sure to grasp this opportunity to gain knowledge and build relationships.  Engage with both retailers and logistics operators in a unique, collaborative setting. Discover how the industry is rapidly changing to meet the demands of the ‘anything, anytime, anywhere’ customer. Learn about innovative new approaches that decrease the risk of failed deliver from across Europe. Find out more about emerging trends in fulfilment, last mile delivery and cross-border e-commerce. Hear from game-changing start-ups that are attempting to reshape an already rapidly evolving sector.   ''A really meaningful event attended by Industry heavy hitters. It was an intensely valuable experience covering topics that are vitally important in today's and tomorrow's markets.'' - General Manager, Central Planning, Operations, John Lewis Partnership  ''It was a very insightful conference helping us to rethink our positioning and designing of delivery solutions for the e-commerce market needs.” - Director of E-Commerce, CTT Portugal Post  Please visit the website for more information on the programme and speakers. For any queries call +44 (0)207 760 8699 or send an email at conferences@marketforce.eu.com.  Speakers: Navabi, EMEA, Shop Direct, eBay, PostNord, Norway Post, John Lewis Partnership, Clipper Logistics, OVS & Upim, Yodel, Jersey Post Global",GBR,,England,London,"https://crunchbase-production-res.cloudinary.com/image/upload/c_lpad,h_120,w_120,f_jpg/v1498214688/owxisvxmkhopokj8g1g0.jpg",conference
d7ecff71-7a4e-cd96-e84a-af296a23c8a3,Automobile Barcelona Connected Hub,event,automobile-barcelona-connected-hub-2017511,https://www.crunchbase.com/event/automobile-barcelona-connected-hub-2017511,10544.0,2017-05-28 11:50:13,2018-02-13 01:14:25,The European platform for the Connected Automobile Industry.,2017-05-11,2017-05-12,http://www.automobilebarcelona.com/en/event-overview,http://www.automobilebarcelona.com/en/event-overview,Fira Barcelona,The European platform for the Connected Automobile Industry Technological innovations and connectivity are key factors for the present and the future of the automobile industry. The aim of Connected Hub is to gather and to become the meeting point for the key players around the Connected Car.,ESP,,Catalonia,Barcelona,"https://crunchbase-production-res.cloudinary.com/image/upload/c_lpad,h_120,w_120,f_jpg/v1495972049/ol8yz9w97cjqdbjul90h.png","demo_day,expo"
01608843-4aef-9885-9f29-b3400ec80aee,Capital On Stage,event,capital-on-stage-20141030,https://www.crunchbase.com/event/capital-on-stage-20141030,11884.0,2014-11-11 02:47:48,2018-02-13 01:14:28,Up to 200 venture capitalists and selected tech startup founders will be invited to our third annual conference.,2014-10-30,2014-10-30,,http://bit.ly/COSNY14EV,Microsoft Technology Center,,USA,NY,New York,New York,"https://crunchbase-production-res.cloudinary.com/image/upload/h_120,w_120,f_jpg/v1507847753/placeholder_zgpxrr.png",conference
32efa3a5-240a-79fa-532c-c4eeefd972a3,Python for Data Analysis - 2 Week Workshop,event,python-for-data-analysis---2-week-workshop-2015324,https://www.crunchbase.com/event/python-for-data-analysis---2-week-workshop-2015324,15184.0,2015-03-10 18:16:53,2018-02-13 01:14:28,"Python is the most versatile programming language for coding with data, and the one with the fastest-growing user base among Data Scientists",2015-03-24,2015-04-07,,https://www.eventbrite.com/e/python-for-data-analysis-tickets-15203596366,Galvanize SF,,USA,CA,California,San Francisco,"https://crunchbase-production-res.cloudinary.com/image/upload/c_lpad,h_120,w_120,f_jpg/v1426011342/ka5pm2eanyijum5ecu8a.png",other
47d863b8-5088-40f6-b10f-c205b3852d82,HackerX-Irvine/Orange County (Full-Stack) Employer Ticket - 3/28,event,hackerx-irvine-orange-county-full-stack-employer-ticket-3-28,https://www.crunchbase.com/event/hackerx-irvine-orange-county-full-stack-employer-ticket-3-28,2912.0,2019-03-28 09:09:34,2019-03-28 09:09:34,"HackerX is an invite-only recruiting event for developers in 120+ cities globally and has a community of over 100,000+ members.",2019-03-28,2019-03-28,https://hackerx.org/employers/,https://www.eventbrite.com/e/hackerx-irvineorange-county-full-stack-employer-ticket-328-tickets-53993136926,Zillow,"HackerX is an invite-only recruiting event for developers in 120+ cities globally and has a community of over 100,000+ members. We've hand picked and recruited some of the top developers in each city so you don't have to. Meet face-to-face with qualified and screened developers and make your next great hire. MEET 50+ TOP BACK-END DEVELOPERS Our events are organized in rapid speed-dating format (5 minutes each) to keep things engaging and fun. It ensures you can meet the most developers. WHY ATTEND? - Get in front of developers face-to-face and skip the back and forth emailing and phone tag. - Showcase your company's brand and technologies to let the developer community know you're hiring. - After the event, we'll also provide you a list of registrations (~90) so you can scout and reach out after the event. FAQ Q: What should I bring? A: We recommend bringing an iPad or laptop to show off your company. You're also welcome to bring banners, other visuals, and swag. Q: Can I bring multiple people? A: Absolutely, but you will need to buy an additional ticket for each person. We highly recommend having multiple people to be able to work the room. Q: How do you ensure quality? Q: To ensure quality, our events are invite-only for developers so almost everyone has a solid work history or background. Q: Do you collect a commission? A: No, we never take a fee outside of the ticket price. QUOTES ''HackerX is a great event that connects job seekers and employers seeking engineering talent. BitTorrent participated in 3 events and ended up hiring 3 engineers for key positions.'' FARID FADAIE, SENIOR DIRECTOR OF PRODUCT - BITTORRENT ''HackerX has been very beneficial for TrueCar as it gives us an opportunity to meet and talk with prospective candidates. The casual environment puts the candidate at ease so they can represent themselves to the fullest. We have successfully hired several candidates!'' CHRIS MARTIN, MANAGER OF TALENT ACQUISITION - TRUECAR",USA,CA,California,Irvine,"https://crunchbase-production-res.cloudinary.com/image/upload/c_lpad,h_120,w_120,f_jpg/yix2op1ij98djxg4snwj","meetup,networking,other"
4cd16824-dbd8-b150-bbdd-91ee3c255501,BioProcess International West 2017,event,bioprocess-international-west-2017-2017227,https://www.crunchbase.com/event/bioprocess-international-west-2017-2017227,16143.0,2017-02-23 05:09:37,2018-02-13 01:14:18,The BPI West 2017 agenda format is designed to break down silos across multiple departments that work in the same stage of development.,2017-02-27,2017-03-02,https://lifesciences.knect365.com/bpi-west/,https://lifesciences.knect365.com/bpi-west/purchase/select-package,Hilton San Francisco Union Square,"The BPI West 2017 agenda format is designed to break down silos across multiple departments that work in the same stage of development. With four concurrent tracks focused on early stage process development through commercial manufacturing, attendees can collectively share challenges and discuss the solutions needed to improve the speed, cost and quality of biologics development.",USA,CA,California,San Francisco,"https://crunchbase-production-res.cloudinary.com/image/upload/c_lpad,h_120,w_120,f_jpg/v1487826390/whnwjcuxlwsnbmqripyw.png",conference
753378f1-79db-44ff-ad49-57f8f6ce0051,European Collaboration Summit 2018,event,european-collaboration-summit-2018,https://www.crunchbase.com/event/european-collaboration-summit-2018,4587.0,2018-07-05 21:05:31,2018-07-05 21:05:31,European Collaboration Summit 2018 Mainz,2018-05-28,2018-05-31,,https://www.collabsummit.eu/,,,,,,,"https://crunchbase-production-res.cloudinary.com/image/upload/c_lpad,h_120,w_120,f_jpg/zoie34rttmviyc0qpnvy",conference
