uuid,name,type,permalink,cb_url,rank,created_at,updated_at,short_description,started_on,ended_on,event_url,registration_url,venue_name,description,country_code,state_code,region,city,logo_url,event_roles
7ddd2300-37d0-64e9-8764-3560f8c42b45,Ladybosses: Women in Tech & Media,event,ladybosses-women-in-tech-media-2016420,https://www.crunchbase.com/event/ladybosses-women-in-tech-media-2016420,17295.0,2016-04-13 06:41:05,2018-02-13 01:14:25,Attendees will learn from entrepreneurs and high-level decision makers in the tech and media industries.,2016-04-20,2016-04-20,,https://www.eventbrite.com/e/ladybosses-women-in-tech-media-tickets-24466774782,Spotify Headquaters,"We’d like to invite you to the Ladies@ Spring Networking Event! Ladies@ is an organization dedicated to promoting positive growth for women in tech through frank dialogue, corporate partnerships, and mentorship opportunities.   The theme for this event is Ladybosses and what it means to be a power player in the start-up world.   Attendees will learn from entrepreneurs and high-level decision makers in the tech and media industries on how to grow and leverage a professional network.  To help you grow your network ASAP, we'll have a breakout session for audience members to connect with our Ladyboss speakers and with each other.",USA,NY,New York,New York,"https://crunchbase-production-res.cloudinary.com/image/upload/c_lpad,h_120,w_120,f_jpg/v1460580704/n7m6bbragzc0doiyednr.jpg","conference,meetup,other"
c5bb2e5d-3256-fa0e-ce6d-709f0e94a64e,Startup Weekend Warsaw FinTech,event,startup-weekend-warsaw-fintech-20141114-warsaw,https://www.crunchbase.com/event/startup-weekend-warsaw-fintech-20141114-warsaw,7606.0,2014-10-17 23:16:01,2018-02-13 01:14:28,Startup Weekends are 54-hour events designed to provide superior experiential education for technical and non-technical entrepreneurs.,2014-11-14,2014-11-16,,http://swwarsawfintech1114.eventbrite.com/?aff=ebapi,Dom Towarowy Bracia Jab?kowscy,"* What is it:   Exactly what it says on the tin! A 54-hour event for developers, designers and entrepreneurs to hack on your latest fintech idea. You will be able to present your own concept and form a team around it or join forces with someone else. Over the weekend, you will be putting the foundations of a business case, designing and building a product prototype, testing your assumptions with a potential customers, and, on Sunday night, pitch the results of your weekend's work to a panel of investors and industry titans from across banking, insurance and payments. What's more, over the weekend, you will have access to over ten industry experts and mentors to help you bring your ideas to life.   * Who is it for:  Anyone with a passion for fintech is welcome! If you've been toying with an idea, but need a final push to make it happen, if you are looking for ways for form a great team, or if you are simply excited to get involved with a fintech startup at its conceptualisation, this weekend is for you. ",POL,,Mazowieckie,Warsaw,"https://crunchbase-production-res.cloudinary.com/image/upload/c_lpad,h_120,w_120,f_jpg/v1407304682/g3q8sthovyaosxac25qp.png",conference
72934bb1-7b1b-4b1b-8606-45acf9ca1df9,Sandbox Illuminate - Idea to Execution,event,sandbox-illuminate-idea-to-execution,https://www.crunchbase.com/event/sandbox-illuminate-idea-to-execution,3714.0,2018-11-09 12:25:49,2018-11-09 12:25:49,A platform for Start-up Enthusiasts to nurture their ideas.,2018-05-10,2018-05-10,https://sandboxstartups.org/events,https://sandboxstartups.org/illuminate,,"Entrepreneurs across India are invited to come up with ideas, present their business plan, and win incubation support from Sandbox Startups.",,,,,"https://crunchbase-production-res.cloudinary.com/image/upload/c_lpad,h_120,w_120,f_jpg/clw5xolefa9fwn1zh5kh",competition
5b66efbf-4603-4616-bab7-2c821b40f365,Microsoft Ignite 2018,event,microsoft-ignite-2018,https://www.crunchbase.com/event/microsoft-ignite-2018,50.0,2017-12-22 05:34:54,2018-09-07 21:52:06,"Microsoft Ignite gives you five days of hands-on learning, industry insights, and direct access to product experts. ",2018-09-24,2018-09-28,https://www.microsoft.com/en-us/ignite,https://msignite.eventcore.com/auth/login,Orange County Convention Center,"Get the latest insights and skills from technology leaders and practitioners shaping the future of cloud, data, business intelligence, teamwork and productivity. Immerse yourself with the latest tools, tech, and experiences that matter, and hear the latest updates and ideas directly from the experts.",USA,FL,Florida,Orlando,"https://crunchbase-production-res.cloudinary.com/image/upload/c_lpad,h_120,w_120,f_jpg/kp0n6gkpykga0mrzqdod","conference,meetup,seminar"
aed72798-22e6-c242-c1dd-82077fdd1880,Empire Startups NY FinTech Conference,event,empire-startups-ny-fintech-conference-2016426,https://www.crunchbase.com/event/empire-startups-ny-fintech-conference-2016426,2943.0,2015-12-28 18:49:31,2018-02-13 01:14:19,This full-day conference showcases Silicon Alley FinTech at its best.,2016-04-26,2016-04-26,http://www.fintechstartupsconference.com/nyagenda,http://www.fintechstartupsconference.com/,Webster Hall,,USA,NY,New York,New York,"https://crunchbase-production-res.cloudinary.com/image/upload/c_lpad,h_120,w_120,f_jpg/v1451328480/scpdpcrha8atcrhg2a3d.png","conference,demo_day,meetup,networking"
ea4dc449-7f12-7750-a729-0f7ccbbb9d39,Call To Action Conference 2017,event,call-to-action-conference-2017-2017625,https://www.crunchbase.com/event/call-to-action-conference-2017-2017625,5223.0,2017-04-03 03:28:00,2018-02-13 01:14:21,"The CTAConf environment is about problem solving, knowledge sharing and improving your online marketing.",2017-06-25,2017-06-27,http://calltoactionconference.unbounce.com/,http://calltoactionconference.unbounce.com/register-now/,Queen Elizabeth Theatre,"Our hand-picked speaker lineup brings you the perfect mix of digital marketing topics in a streamlined, single-track event. You'll learn from the best marketing speakers from around the world, all in one place.   The CTAConf environment is about problem solving, knowledge sharing and improving your online marketing. Share ideas and build relationships with advanced marketers from around the world.  You’ll get much more than a conference ticket. All attendees are spoiled with breakfast, lunch, snacks, activities, afterparties, swag, conference notes and full access to the recordings of every session.",CAN,BC,British Columbia,Vancouver,"https://crunchbase-production-res.cloudinary.com/image/upload/c_lpad,h_120,w_120,f_jpg/v1497410964/ltvef5b9adzx1hp5aogt.png","conference,seminar"
5e6f64aa-6e51-abb2-fa3e-088a38995e93,Psychological Architectures of Digital Behavior Change 2015,event,psychological-architectures-of-digital-behavior-change-2015-20151118,https://www.crunchbase.com/event/psychological-architectures-of-digital-behavior-change-2015-20151118,5449.0,2015-08-17 05:41:28,2018-02-13 01:14:27,3rd day advanced workshop,2015-11-18,2015-11-18,http://www.eventbrite.com/e/psychology-for-digital-behavior-change-toronto-2-day-optional-3rd-day-registration-17825181598,http://www.eventbrite.com/e/psychology-for-digital-behavior-change-toronto-2-day-optional-3rd-day-registration-17825181598,University of Toronto,"Whereas our foundational workshop teaches you the core principles of digital behavior change, this workshop will teach you how to combine those principles into winning design patterns, called ‘psychological architectures’. By the end of the workshop, you will understand popular psychological architectures, such as gamification, landing pages, shaping/habit loops, feedback loops, stages of change, and many others.",CAN,ON,Ontario,Toronto,"https://crunchbase-production-res.cloudinary.com/image/upload/h_120,w_120,f_jpg/v1507847753/placeholder_zgpxrr.png",conference
87a17172-853f-8d15-e87b-33a2b67b2530,Techcrunch Meetup + Pitch-Off: Seoul 2015,event,techcrunch-meetup---pitch-off--seoul-2015-2015416,https://www.crunchbase.com/event/techcrunch-meetup---pitch-off--seoul-2015-2015416,12639.0,2015-04-07 06:28:30,2018-02-13 01:14:27,"Meetup + pitch-off event is coming to Seoul for good conversation, and a battle to the death to see which entrepreneurs can dazzle.",2015-04-16,2015-04-16,http://techcrunch.com/events/meetup-pitch-off-seoul-2015/event-home/,http://techcrunch.com/events/meetup-pitch-off-seoul-2015/pitch-off-application/,aA Design Museum,"TechCrunch’s legendary meetup + pitch-off event is coming to Seoul for beer, good conversation, and a battle to the death to see which entrepreneurs can dazzle and excite the judges in under sixty seconds.",KOR,,Seoul-t'ukpyolsi,Seoul,"https://crunchbase-production-res.cloudinary.com/image/upload/h_120,w_120,f_jpg/v1507847753/placeholder_zgpxrr.png","competition,meetup"
84b3f89d-41f0-bfa7-1db9-116045258c35,OSSCube Sponsors the Midmarket CIO Forum,event,osscube-sponsors-the-midmarket-cio-forum-20161023,https://www.crunchbase.com/event/osscube-sponsors-the-midmarket-cio-forum-20161023,14155.0,2016-10-10 11:35:32,2018-02-13 01:14:27,"OSSCube is sponsoring Midmarket CIO Forum in San Antonio, TX, where we will talk about newer technologies.",2016-10-23,2016-10-25,http://www.osscube.com/about/events/midmarket-cio-forum-2016,http://www.osscube.com/about/events/midmarket-cio-forum-2016,La Cantera Resort,"Peer networking. Market insight. Curated solutions. Midmarket CIO Forum is the engaging, informative, and social venue for IT executives and solution providers that covers it all. As the digital future unfolds, join a global community of your CIO peers and gain the insights you need to act, innovate, align your mission critical priorities and transform your business processes.   Some of the Key Highlights of Midmarket CIO Forum are:   * Detailed conference program covering a wide range of industry topics  * Provide a diverse and interactive learning experience with a mix of keynotes, panel discussions, case studies and roundtables   * One-on-one networking opportunities to help mitigate the challenges   * Learn about industry trends from analysts who specialize in the midmarket  * Peer networking and solution research environment, allowing IT executives to customize their appointment with leading solution providers   OSSCube is a sponsor of the summit this year. At the event, we will be showcasing cutting-edge solutions, frameworks, and success stories. We’re equally excited for some great discovery conversations to discuss how we can help your enterprise create a digital strategy and modernize your legacy system.  Meet the Solution Providers Specific to Your Needs:  The Midmarket CIO Forum will help you develop a ''short list'' of technology and service providers who can meet your unique needs. Should you be facing performance constraints with your legacy system or a security concern while migrating your data to the cloud?",USA,TX,Texas,San Antonio,"https://crunchbase-production-res.cloudinary.com/image/upload/c_lpad,h_120,w_120,f_jpg/v1476099186/yukuxxbjd8qmvo86deq5.png",conference
c83f47fe-3d03-44e5-9fee-ec9c3665f1f3,The Rise of Smart Hardware: From Idea to Exit (invite only with 2hr Open Bar),event,the-rise-of-smart-hardware-from-idea-to-exit-invite-only-with-2hr-open-bar,https://www.crunchbase.com/event/the-rise-of-smart-hardware-from-idea-to-exit-invite-only-with-2hr-open-bar,4575.0,2018-07-05 04:16:45,2018-10-26 18:56:24,Smart Hardware 101,2015-07-30,2015-07-30,https://www.eventbrite.hk/e/the-rise-of-smart-hardware-from-idea-to-exit-invite-only-with-2hr-open-bar-tickets-17843400090#,https://www.eventbrite.hk/e/the-rise-of-smart-hardware-from-idea-to-exit-invite-only-with-2hr-open-bar-tickets-17843400090#,,"The Rise of Smart Hardware: From Idea to Exit- A night with hardware founders, investors, Asia experts and key players (invite only with 2hr Open Bar)    Before the RISE conference kicks off,  we thought it would be fun to connect all the IoT teams over drinks. We’re buying so come and network with your fellow IoT colleagues and some key experts from Asia & HK who have deep rooted experience in doing business & manufacturing in Hong Kong and Mainland China. Come and enjoy a drink or two with us and hear from:",,,,,"https://crunchbase-production-res.cloudinary.com/image/upload/c_lpad,h_120,w_120,f_jpg/fb40zswqzr1q0llukhnf",meetup
d1b99b76-d6f6-4603-9afd-f9b26fbd0829,Quandl Data Conference 2019,event,quandl-data-conference,https://www.crunchbase.com/event/quandl-data-conference,187.0,2019-02-25 17:27:47,2019-02-26 10:06:16,Quandl Data Conference 2019,2019-02-28,2019-02-28,https://www.quandl.com/data-conference,https://www.quandl.com/data-conference/tickets,Convene,,USA,NY,New York,New York,"https://crunchbase-production-res.cloudinary.com/image/upload/c_lpad,h_120,w_120,f_jpg/xfcxdntv8lh8oc0nj193",conference
99bb9d6a-82a9-b548-d12a-de96b0e68e4c,Gartner Data & Analytics Summit Grapevine 2018,event,gartner-data-analytics-summit-grapevine-2018-201835,https://www.crunchbase.com/event/gartner-data-analytics-summit-grapevine-2018-201835,10161.0,2017-10-05 09:01:18,2018-02-13 00:06:28,Gartner Data & Analytics Summit Scale the Value of Data and Analytics Data and analytics are at the heart of the digital revolution.,2018-03-05,2018-03-08,http://www.gartner.com/events/na/data-analytics#,http://www.gartner.com/events/na/data-analytics#!registration,Gaylord Texan Hotel & Convention Center,"Gartner Data & Analytics Summit Grapevine 2018 Scale the Value of Data and Analytics Data and analytics are at the heart of the digital revolution.   To survive and thrive in the digital era, now is the time to drive data and analytics into the core of your business and scale outward to every employee, customer, supplier and partner. Scaling the value of data and analytics requires a culture of data enablement that extends throughout every facet of your organization. A culture where data and analytics inform and drive business objectives, operational efficiencies and innovation.  Join us onsite in March to secure your place at the forefront of digital business leadership",USA,TX,Texas,Grapevine,"https://crunchbase-production-res.cloudinary.com/image/upload/c_lpad,h_120,w_120,f_jpg/v1507194071/csozema35ixsj6kkm1pv.png","conference,seminar"
85c5966b-3abc-1384-a11b-390aced9967a,MoCo TechBreakfast,event,moco-techbreakfast-20151124,https://www.crunchbase.com/event/moco-techbreakfast-20151124,6038.0,2015-05-11 05:46:18,2018-02-13 01:14:21,"TechBreakfast is a fun, a monthly demo-style event where entrepreneurs and tech folks see showcases on cool new technology in a demo format.",2015-11-24,2015-11-24,,http://www.meetup.com/TechBreakfast/events/218600042/,JHU - Rockville,,USA,MD,Maryland,Rockville,"https://crunchbase-production-res.cloudinary.com/image/upload/c_lpad,h_120,w_120,f_jpg/v1431323039/vor0tufwc4ncwmbnlnrd.png",meetup
fdb553d9-fca5-4283-9b9d-5feec7a8ffd8,3rd annual Nuclear Industrial Control Cybersecurity Resilience conference,event,3rd-annual-nuclear-industrial-control-cybersecurity-resilience-conference,https://www.crunchbase.com/event/3rd-annual-nuclear-industrial-control-cybersecurity-resilience-conference,6979.0,2018-03-10 06:02:08,2018-03-10 06:02:08,"Now in its 3rd year, the Cyber Senate Nuclear Industrial Control Cyber Security and Resilience Conference will take place on May 22/23rd",2018-05-22,2018-05-23,,http://go.evvnt.com/207549-0?pid=5396,Park Royal,"Protecting essential services and control systems networks are imperative and in many cases neglected in relation to embedded systems in modern architecture. The proliferation and advancement of operational technologies and the Internet of Things, the convergence of IT and OT have enhanced operational efficiency but paradoxically has increased the attack surface exponentially across the critical national infrastructure. Now in its 3rd year, the Cyber Senate Nuclear Industrial Control Cyber Security and Resilience Conference will take place on May 22/23rd in Warrington United Kingdom. This two day executive forum will include presentations, roundtable working groups and panel sessions. Together we will address the escalating cyber risk and resilience challenges associated with the adoption and convergence of operational technologies in enterprise facing architecture. Practitioners will gain further insight into how to best respond to evolving cyber threats, the importance of effective risk management throughout the nuclear supply chain, innovations in detection and mitigation, configuration management and how can we incorporate resilience into critical control system components and business process. Time: 09:00 to 17:00 Price: Commercial Ticket: GBP 799, Asset Owners: GBP 499  Venue details: Park Royal, Stretton Road, Stretton, Cheshire, WA4 4NS, United Kingdom Speakers: Franky Thrasher ENGIE Laborelec Information Systems Security Officer and Senior Cybersecurity Expert, Ken Munro Pen Test Partners Founder and Partner, Robin Bloomfield Adelard Partner, Andrew Rogoyski CGI Vice President Cyber Security Services, Phil Litherland Context Information Security Principal Consultant Strategy and Advisory, Guido Gluschke Brandenburg University of Applied Sciences Co-Director Institute for Security and Safety (ISS), Cavus Batki EDF Nuclear New Build Design Authority cyber security specialist, John Dickinson Sellafield Ltd Cybersecurity Control Systems Manager Control Systems Group, Tom Parkhouse Office for Nuclear Regulation Head of Nuclear Cyber Security Regulation within the Civil Nuclear Security Division, Peter Fraser Hopewell ETC-Enrichment Technology Company ETC Head of Group Security, Will Ollerhead ETC-Enrichment Technology Company Group Information Security Manager, Chris Blask Unisys, ICS ISAC Director, Industrial Control Systems Security at Unisys, Chair US ICS ISAC, Mike St John Green Independent Information Security Expert Speaker, Dai Davis Percy Crow Davis and Co Technology Lawyer, Alfonso Martin iHacklabs Senior Manager Industrial Cybersecurity",GBR,,Warrington,Stretton,"https://crunchbase-production-res.cloudinary.com/image/upload/c_lpad,h_120,w_120,f_jpg/dlmgatymn6e9xpdaktb3",conference
1f6b4dd1-d5be-4fe4-84ad-1c3858904a52,SmartRecruiters Hiring Success,event,smartrecruiters-hiring-success,https://www.crunchbase.com/event/smartrecruiters-hiring-success,3063.0,2018-03-14 22:25:47,2018-03-14 22:25:47,Where the future of hiring happens.,2018-03-13,2018-03-14,,http://ta.smartrecruiters.com/hiring-success-18-speakers.html,Hyatt Regency,Where the future of recruiting happens,USA,CA,California,San Francisco,"https://crunchbase-production-res.cloudinary.com/image/upload/h_120,w_120,f_jpg/v1507847753/placeholder_zgpxrr.png",conference
c6f08429-366b-9515-4749-1b6db42b0e6b,Seattle Startup Week Keynote Rob Glaser Seattle Startup Week,event,seattle-startup-week-keynote-rob-glaser-seattle-startup-week-20141023-seattle,https://www.crunchbase.com/event/seattle-startup-week-keynote-rob-glaser-seattle-startup-week-20141023-seattle,14096.0,2014-10-17 23:14:00,2018-02-13 01:14:24,Join us for this very special Seattle Startup Week keynote!,2014-10-23,2014-10-23,,http://www.eventbrite.com/e/seattle-startup-week-keynote-rob-glaser-seattle-startup-week-tickets-13705089291?aff=ebapi,Kane Hall,Join us for this very special Seattle Startup Week keynote! Our guest for the evening is Rob Glaser.,USA,WA,Washington,Seattle,"https://crunchbase-production-res.cloudinary.com/image/upload/c_lpad,h_120,w_120,f_jpg/v1407304682/g3q8sthovyaosxac25qp.png",conference
3f24513e-9247-4312-80d2-40f512a33d14,The Year Ahead,event,the-year-ahead,https://www.crunchbase.com/event/the-year-ahead,2956.0,2019-03-24 20:40:08,2019-03-24 20:40:08,"The Year Ahead Summit, an invitation-only event creating a 360-degree view of the most urgent topics facing every executive.",2018-11-28,2018-11-28,https://www.bloomberglive.com/the-year-ahead/,https://www.bloomberglive.com/the-year-ahead/,,"Change is the one constant that unifies global CEOs — and the pace of change only seems to be quickening. Which is why Bloomberg convenes The Year Ahead Summit, an invitation-only event creating a 360-degree view of the most urgent topics facing every executive in the coming year.",,,,,"https://crunchbase-production-res.cloudinary.com/image/upload/c_lpad,h_120,w_120,f_jpg/igkrjohatpqn9d8durcb",conference
3935bf43-4e72-4c7f-b4fd-7034fe266a2a,Assure Hair,event,assure-hair,https://www.crunchbase.com/event/assure-hair,,2018-02-01 08:08:36,2018-02-13 00:23:39,Assure Hair - Hair Regrowth Treatment for Long & Shiny Hairs,2018-02-01,2018-06-04,http://www.healthychatboard.com/assure-hair/,http://www.healthychatboard.com/assure-hair/,,Assure Hair - Nothing more natural than good previous exercising! One of the many advantages of physical activity is enhancing blood flow throughout the body. Hair follicles benefit from better blood flow and will maintain and improve their health stimulating hair growth. Read More : http://www.healthychatboard.com/assure-hair/,,,,,"https://crunchbase-production-res.cloudinary.com/image/upload/c_lpad,h_120,w_120,f_jpg/cxyaanfbdheeitrclsog",conference
2098398b-baa8-435c-8264-e7b745adc645,HackerX - Cambridge (Full-Stack) Employer Ticket - 3/28,event,hackerx-cambridge-full-stack-employer-ticket-3-28,https://www.crunchbase.com/event/hackerx-cambridge-full-stack-employer-ticket-3-28,2911.0,2019-03-28 08:46:51,2019-03-28 08:46:51,"HackerX is an invite-only recruiting event for developers in 120+ cities globally and has a community of over 100,000+ members.",2019-03-28,2019-03-28,https://hackerx.org/employers/,https://www.eventbrite.com/e/hackerx-cambridge-full-stack-employer-ticket-328-tickets-55049407259,1 Station Square,"HackerX is an invite-only recruiting event for developers in 120+ cities globally and has a community of over 100,000+ members. We've hand picked and recruited some of the top developers in each city so you don't have to. Meet face-to-face with qualified and screened developers and make your next great hire. MEET 50+ TOP BACK-END DEVELOPERS Our events are organized in rapid speed-dating format (5 minutes each) to keep things engaging and fun. It ensures you can meet the most developers. WHY ATTEND? - Get in front of developers face-to-face and skip the back and forth emailing and phone tag. - Showcase your company's brand and technologies to let the developer community know you're hiring. - After the event, we'll also provide you a list of registrations (~90) so you can scout and reach out after the event. FAQ Q: What should I bring? A: We recommend bringing an iPad or laptop to show off your company. You're also welcome to bring banners, other visuals, and swag. Q: Can I bring multiple people? A: Absolutely, but you will need to buy an additional ticket for each person. We highly recommend having multiple people to be able to work the room. Q: How do you ensure quality? Q: To ensure quality, our events are invite-only for developers so almost everyone has a solid work history or background. Q: Do you collect a commission? A: No, we never take a fee outside of the ticket price. QUOTES ''HackerX is a great event that connects job seekers and employers seeking engineering talent. BitTorrent participated in 3 events and ended up hiring 3 engineers for key positions.'' FARID FADAIE, SENIOR DIRECTOR OF PRODUCT - BITTORRENT ''HackerX has been very beneficial for TrueCar as it gives us an opportunity to meet and talk with prospective candidates. The casual environment puts the candidate at ease so they can represent themselves to the fullest. We have successfully hired several candidates!'' CHRIS MARTIN, MANAGER OF TALENT ACQUISITION - TRUECAR",USA,MA,Massachusetts,Cambridge,"https://crunchbase-production-res.cloudinary.com/image/upload/c_lpad,h_120,w_120,f_jpg/rvzocemktzsjexp6smyw","meetup,networking,other"
3bb50d14-ca51-ce59-660b-80be7b66b8a9,"Digital HR. Unterstützer, Treiber oder Wegweiser: Welche Rolle spielt HR?",event,digital-hr-unterstutzer-treiber-oder-wegweiser-welche-rolle-spielt-hr-2017223,https://www.crunchbase.com/event/digital-hr-unterstutzer-treiber-oder-wegweiser-welche-rolle-spielt-hr-2017223,11028.0,2017-02-22 13:37:26,2018-02-13 01:14:28,DGFP //Kompetenzforum DGFP-Mitgliedsunternehmen mit Fokus aufDigitalisierung und Personalentwicklung trafen sich zum Erfahrungsaustausch.,2017-10-28,2017-10-29,https://www.coaching-cosmos.com/presse/artikel/news-digital-hr-untersttzer-treiber-oder-wegweiser-welche-rolle-spielt-hr/10/,https://www.coaching-cosmos.com/presse/artikel/news-digital-hr-untersttzer-treiber-oder-wegweiser-welche-rolle-spielt-hr/10/,Headquarters,,DEU,,Berlin,Berlin,"https://crunchbase-production-res.cloudinary.com/image/upload/c_lpad,h_120,w_120,f_jpg/v1487770421/v8glwypid6tjfg2vvbw1.png","conference,other"
c2338c9d-5808-740d-530f-3721dfba3f2c,Columbia TechBreakfast,event,columbia-techbreakfast-20151014,https://www.crunchbase.com/event/columbia-techbreakfast-20151014,14803.0,2015-05-10 11:16:23,2018-02-13 01:14:22,"TechBreakfast is a fun, a monthly demo-style event where entrepreneurs and tech folks see showcases on cool new technology in a demo format.",2015-10-14,2015-10-14,,http://www.meetup.com/TechBreakfast/events/216855352/,Loyola Columbia,,USA,MD,Maryland,Columbia,"https://crunchbase-production-res.cloudinary.com/image/upload/c_lpad,h_120,w_120,f_jpg/v1431256525/haiz8ulrtqjzvrd13bpx.png",meetup
