uuid,name,type,permalink,cb_url,rank,created_at,updated_at,description
c7a2b54a-87ab-0ef4-7708-51c2373767c4,Minerx store,person,minerx-store,https://www.crunchbase.com/person/minerx-store,851240.0,2015-12-31 08:30:01,2018-02-13 00:01:04,"<b>Minerxstore</b> for hair and skin care products. We provides the best remedies for your hair related problems like hair fall, hair loss or male pattern baldness as well as your skin related problems such as skin acne, blackheads, whiteheads, wrinkles, greasy skin, lethal skin etc. We provides the best remedy to treat any kind of above hair and skin related problems."
22c9dd61-ef9a-47fc-9c0b-049bbb7ee3b5,Ariel Baleli,person,arie-l-baleli,https://www.crunchbase.com/person/arie-l-baleli,549452.0,2018-02-15 10:10:58,2018-09-08 01:26:47,"Ariel Baleli is very concerned with customer satisfaction with offers various services such as Residential Remodeling,Kitchen Remodeling,Bathroom Remodeling,Additions,Whole House Remodeling,Custom Cabinetry or design Services."
7766bf75-7d81-4f86-5380-e3119af28b2a,Arthur Scherpenzeel,person,arthur-scherpenzeel,https://www.crunchbase.com/person/arthur-scherpenzeel,182979.0,2016-03-08 10:25:05,2018-02-12 23:55:08,Arthur Scherpenzeel is a Founder at Stepping Stones Home & Care.
a830674a-9c94-b53a-65bc-9b958c9c6fda,Rajeev Karwal,person,rajeev-karwal,https://www.crunchbase.com/person/rajeev-karwal,346275.0,2015-01-08 09:06:52,2018-02-12 23:03:57,"Rajeev Karwal In a career spanning over 31 years, Rajeev has worked on startups, turnarounds and more. Rajeev is known for his strategic abilities and excellent execution. His passion for excellence and impeccable track record made him directly debut at the 43rd position in the Economic Times India’s Most Powerful CEOs list in 2004. Known as the Poster Boy of Consumer Durables industry he is considered one of the greatest brand builders in India. His brand building efforts at LG, ONIDA, Philips and Electrolux are part of marketing folklore. In 1998 he won A&M’s Indian Marketing Person of the Year Award and in 2003 a book by Dr. R L Bhatia featured him among India’s Greatest Brand Builders. His spectacular turnaround effort at reviving Philips Consumer Electronics and Electrolux also earned him the tag of an ace turnaround specialist. His contribution to the start-ups at Onida, LG and Reliance Retail gave the world a peek into his scale-up and start-up expertise. He is perhaps the only senior executive in Consumer Durables space in India to have had a manufacturers view as well as that of a consumer electronics retailer. His successes were recognized by corporate India and by society at large. In 2002 he was featured in Business Today’s Top 25 Hot Young Rising Stars of India Inc. In 2001 he won India’s Young Manager Trophy, awarded by Confederation of Indian Industry. In 2000 he was voted one of the Stars of the Millennium by Business India. Through 2000-02, he won Philips International Leadership Grand Prix Championships. In 1997, he won the Marketing Manger with HR Orientation Award from the Asia HR Congress. After stepping down from the post of President & CEO of the Consumer Durables Vertical of Reliance Retail, he founded Milagrow Business & Knowledge Solutions in 2007, to help growth seeking enterprises with unique ‘Venture Catalyst’ approach. His mission is to make Milagrow ‘the destination for Growth Seeking Business’, and to partner with these aspiring enterprises as a Venture Catalyst to build best-in-class managerial and organizational capabilities in them. For 2007-08 he was the National Chair of the Integrity India Campaign, initiated by YI CII and he championed the cause of integrity in corporations with the slogan Growth with Integrity, India’s Dignity. He was the founding member of Young Indian in 2001 and served on the governing council for 7 years. He also served CII’s National Core Committee on Retail in 2006-07. In 2005 he was the National Chair, Consumer Durables, and a Member of the National Council of CII. From 2000-2003 he was the Consumer Electronics and Manufacturers Association (CETMA) President, now CEAMA. For 2003, he was a member of the National Council of FICCI and for 2207-8 he headed the Retail Panel ‘Chief Ministers Group’ at FICCI, to influence the framing of the right policy framework for the growth of the Retail Sector in India. His first book, 'Corporate Blogging in India' was released recently and it is also the only one which has been written on this topic in India. Rajeev keeps himself relevant by continuously learning new ways to innovate, communicate and execute ideas to success. Rajeev also reflects his thoughts on his blog here. His blog is amongst the most popular CEO blogs in India."
257ab714-7a2b-c62c-ff90-5ae136794df5,Jaeson Cardiff,person,jaeson-cardiff,https://www.crunchbase.com/person/jaeson-cardiff,491307.0,2017-03-06 12:16:54,2018-02-12 23:59:28,"Jaeson is the CleanO2 project leader and hardware designer. He has 15 years of experience in the heating industry. Jaeson is responsible for the current design, ongoing refinements and pilot testing of the CARBiNX prototype units currently in operation. He also provides design, technical, market access, heating industry expertise, credibility and reputation, as well as financial expertise to the development of technology."
c6b1bd18-4c0d-163f-b4b3-782c0069c6e2,Patrick Manasse,person,patrick-manasse-2,https://www.crunchbase.com/person/patrick-manasse-2,80270.0,2015-06-24 19:15:08,2019-02-26 20:00:25,"Patrick Manasse is the Founder and Chief Compliance Officer for MonetaGo Financial Technology company which leverages blockchain and other technologies to create networks for Financial Institutions. Having lived in nearly every corner of the globe, Patrick now calls New York City home. Prior to working with MonetaGo, Manasse pursued a number of initiatives that combined his interests in both business and law. At McGill Univeristy, Manasse received a B.A. in Economics. He then took an internship at Lazard Investment Bank in Paris. Although offered a position to stay on, he decided to more actively pursue his interest in law. He enrolled at the University of Bond, Australia, where he earned his JD. An agreement between Bond University and and the American Bar Association allowed Manasse to take the bar in either New York or Los Angeles upon his graduation.  After being offered an opportunity to work with the much lauded Spitfire Pictures, Manasse decided to move to LA. During his time with Spitfire, Manasse worked closely with Guy East and Nigel Sinclair. He assisted the company in the production of a number of films including Martin Scorcese's ''No Direction Home'', which won an Emmy Award, two Grammy Awards, and a Peabody Award. Having gathered ample work experience under the purview of East and Sinclar, Manasse then moved to New York City where he worked as a paralegal while also preparing to take the New York Bar. His work as a paralegal lead him to a position as an associate with the international law firm Guzov Ofsink. There he worked for both the Corporate and Commercial Litigation groups."
f2021b94-afe4-ba56-c626-127ab2946938,Harsh Samasraj,person,harsh-samasraj,https://www.crunchbase.com/person/harsh-samasraj,696649.0,2016-01-12 05:27:14,2018-02-12 23:52:22,Founder at Hymnn Music.
b93fe0b5-a14b-4e47-b15a-7cc54e9e6bc6,Daniel Riazzoli,person,daniel-riazzoli,https://www.crunchbase.com/person/daniel-riazzoli,253822.0,2014-03-12 13:01:43,2018-02-12 23:35:23,"Eight years' investment experience, most recently as Senior Associate at FSN Capital Partners and prior to that as Associate at 3i Nordic. Also three years as a management consultant with McKinsey & Co."
4ab426e6-4b1f-47d0-b18c-fb532a8d75c6,Thuc Tran,person,thuc-tran,https://www.crunchbase.com/person/thuc-tran,329266.0,2017-12-18 12:17:21,2018-09-08 02:32:24,"Thuc Tran is a Ph.D. candidate in systems engineering at George Washington University, having previously completed his M.S. in computer science at Georgia Tech. He also has an M.S. in systems engineering from George Washington University, and a B.S. in information technology from George Mason University. His previous work includes recommendation systems and micro service-oriented web technologies at Gannett / USA Today Network."
e04d711b-f10a-9a58-a583-573d8fcd830f,Kinnar Solanki,person,kinnar-solanki,https://www.crunchbase.com/person/kinnar-solanki,792507.0,2014-09-24 10:27:07,2018-02-12 23:41:37,Founder of Ducktile.
b61d0a11-737d-4548-8e83-127af8221fe5,Guzman Diaz,person,guzman-diaz,https://www.crunchbase.com/person/guzman-diaz,35642.0,2018-02-14 11:09:25,2018-10-15 08:34:42,"Guzman focuses on venture investments in gaming, media and entertainment. He is particularly interested in businesses that enable people to interact with others through content. Prior to Index, Guzman worked at on-demand taxi service Hailo until its merger with mytaxi. He also worked at Korean interest-based social network Vingle and at mobile game developer Social Point. Guzman graduated with a degree in Economics from Universitat Pompeu Fabra. He currently lives in London and regularly spends time in San Francisco and New York."
2a53e049-2c30-6e10-2447-939647d18943,David Hale,person,david-hale-6,https://www.crunchbase.com/person/david-hale-6,512037.0,2016-10-06 07:23:24,2018-02-12 23:35:14,"David is a lead advisor to Avondale’s San Francisco Bay Area wealth management clients. He also focuses broadly on growth for Avondale’s wealth and asset management divisions on the West coast. Bringing more than 15 years of wealth management experience to the firm, David’s background and expertise center on helping affluent and high net worth individuals make asset allocation, portfolio management and financial planning decisions.   Prior to joining Avondale in 2012, David was the sole Managing Principal of DNH Capital, LLC, a boutique wealth and asset management firm in San Francisco where he handled all marketing and relationship management duties and spearheaded asset allocation and portfolio management decisions.  David, based in Avondale’s San Francisco office, is a graduate of Loyala University in Chicago where he earned a BS in both Finance and Marketing and a minor in French Literature. He is currently studying at University of California at Berkeley Extension to obtain a Certificate in Personal Financial Planning. In his spare time, he enjoys distance running, snowboarding, and spending time with his wife Casey and their three young children."
2888e2bd-21de-ba1a-6ba8-7ca4efe25347,Ryan Brown,person,ryan-brown-8,https://www.crunchbase.com/person/ryan-brown-8,353952.0,2016-11-14 13:20:40,2018-02-12 23:19:42,"As a Portfolio Manager on the equity team, Ryan Brown is responsible for the day-to-day portfolio management and trading for U.S. equity-based investment strategies. Ryan also contributes to the ongoing research efforts of these strategies. Prior to joining Analytic, Ryan worked for Beekman Capital Management, in Santa Fe, New Mexico, where he was responsible for selecting stocks within the financial services sector. Ryan received a B.S. in Economics at Brigham Young University and an M.S. in Finance at the University of Utah."
e246b0e6-7d9b-74cf-8c56-b753386b2f44,Claus Schmiedel,person,claus-schmiedel,https://www.crunchbase.com/person/claus-schmiedel,850587.0,2014-03-18 15:36:10,2018-02-12 23:54:24,"Claus Schmiedel was born in 8 March 1951 in Ludwigsburg, protestant. He is a member of the SPD since 1972. 1975-1991 City Council in Marbach. 1985 to 1994 and from 2009 a member of the County Council in Ludwigsburg. 1994-2008 Chairman of the SPD fraction of the Verband Region Stuttgart. Since 2010 member of the Regional Assembly of the Verband Region Stuttgart. Member of the Landtag of Baden-Württemberg since 24 April 1992. Since 2008 Chairman of the SPD parliamentary group.   "
