uuid,name,type,permalink,cb_url,rank,created_at,updated_at,description
ca4a85ea-5e36-f60a-3a88-3e9393109a9f,Carol Yu,person,carol-yu,https://www.crunchbase.com/person/carol-yu,54582.0,2013-08-13 14:31:56,2018-02-12 23:40:28,"Ms. Carol Yu joined Sohu in March 2004 as our Chief Financial Officer.  From March 1995 until November 2000, Ms. Yu served as Senior Vice-President of Investment Banking at Donaldson Lufkin & Jenrette Securities Corporation in Hong Kong.  Ms. Yu also worked with Arthur Andersen Hong Kong and Beijing for ten years and was a partner of the Audit Division, holding the position of General Manager of Arthur Andersen-Hua Qiang, the joint venture accounting firm formed between Arthur Andersen and the Ministry of Finance in China.  Ms. Yu obtained a bachelor’s degree in accounting from The Hong Kong Polytechnic University."
3975203e-73d1-708e-674e-07d309f7cbf7,Paul Okhrem,person,paul-okhrem,https://www.crunchbase.com/person/paul-okhrem,165541.0,2016-12-12 16:20:26,2018-02-12 23:52:48,Over 7 years of experience in business and technical consulting in e-commerce. Strong expertise in Magento consulting.
8a00d143-9e2d-4421-3886-d92b78941922,Emma Huovinen,person,emma-huovinen,https://www.crunchbase.com/person/emma-huovinen,140755.0,2014-05-30 11:04:16,2018-02-12 23:56:00,"Emma is one of the co-founders of MyNextRun. Emma started running with a full marathon, but now likes to participate in shorter races."
55c56353-f010-229b-906c-c29772504706,Mark Santamaria,person,mark-santamaria,https://www.crunchbase.com/person/mark-santamaria,219082.0,2016-08-16 11:33:16,2018-02-13 00:33:51,"Mark Santamaria was promoted to Senior Vice President and Chief Financial Officer in November 2015. He joined AM General as Vice President and Chief Financial Officer on 28 July, 2014. He is responsible for all financial, accounting, tax and risk management matters.  Prior to joining AM General, Mark was a Finance Executive Director at CACI International, Inc. serving as the CFO of National and Cyber Solutions, a Business Group at CACI supporting customers across the Intelligence Community with revenues of approximately $550M. He joined CACI in November 2013.Prior to joining CACI, Mark was the Senior Vice President and Chief Financial Officer for The SI Organization, Inc. In this role, he led the development and implementation of financial strategies across the enterprise to ensure the SI and its customers were well positioned to meet mission goals. The SI Organization is a mid-size federal government contractor with 2,000 employees and annual revenue of approximately $650M. The SI was a carve-out asset sale from the Lockheed Martin Corporation, sold to the private equity firm of Veritas Capital in November 2010. Mark left the SI in January 2013.Mark led a diverse team of finance professionals that provided financial support to the SI’s business in the areas of accounting, treasury, pricing, program finance, government compliance, internal audit, overhead management, global supply chain management, and financial planning and analysis. Mark ensured that the SI met its financial commitments while providing an appropriate return for the company’s shareholders.  Mark has over 28 years of experience in the defense and aerospace industry, charting his career path to gain experience across the full breadth of finance operations. Prior to his position at the SI, Mark was the Director of Business Operations where he led the finance organization of the Enterprise Integration Group (the name of the SI Organization while part of Lockheed Martin) and directed the finance activities throughout the divestiture process.  Prior to that, Mark was the Directorof Cash Management for Lockheed Martin’s Information Systems & Global Services business area. In this role, he directed and coordinated cash improvement initiatives and applied Lean Six Sigma processes, significantly improving the business area’s cash to profit ratio. Mark previously served as the CFO for the Enterprise Solutions and Services operating division where he led an organization of 270 employees and had profit and loss responsibility for this $1.9B division.  Mark also served as Finance Director for the Lean Six Sigma Operating Excellence initiative where he advised businesses on how to more efficiently execute their financial responsibilities.  Mark attended Towson University where he graduated with cum laude honors and received a Bachelor’s degree in business administration, concentrating in the discipline of finance. He is a certified Lean Six Sigma Black Belt and completed the financial management program through the Stanford University Graduate School of Business."
bb017004-7088-0832-f282-c915885d7090,Jason Lobel,person,jason-lobel-3,https://www.crunchbase.com/person/jason-lobel-3,249471.0,2017-09-01 10:47:13,2018-10-22 02:47:36,"Jason Lobel is the Group Head of Video at MTN. Jason is responsible for developing MTN’s video strategy across MTN’s 22 operations in the Middle East and Africa. Prior to joining MTN, he lead the video solutions teams for Africa at Cisco as well as NDS where he was the Regional Director for Africa. Jason also worked at Ericsson where he assisted a number leading Telco develop their data strategies. He has worked with many of the major Telcos, Pay TV operators, broadcasters and content providers across Middle East and Africa. Jason spent his early career working as a management consultant for both Andersen as well as KPMG where he specialized in market development and corporate strategy. Jason has a post-graduate degree in Economics from Rhodes University."
38d83b50-f896-29a9-3515-0efbc487dff5,Douglas Arellanes,person,douglas-arellanes,https://www.crunchbase.com/person/douglas-arellanes,635881.0,2014-04-25 12:12:13,2018-02-12 23:47:18,"Douglas Arellanes (born 1967 near Los Angeles, California, USA) is one of three co-founders of Sourcefabric, a Czech nonprofit foundation devoted to providing technology support to independent media organizations worldwide. He serves as its director of innovation.  Before founding Sourcefabric with Sava Tatić and Micz Flor in 2010, he worked for eight years as a technologist and consultant for the Media Development Loan Fund, an international media support NGO, where he worked on technology projects with news organizations in post-conflict and transition countries.  In the 1990s, Arellanes was an executive with TDC Internet (formerly TeleDanmark), and successfully managed two technology startups, including the first web design agency in the Czech Republic.  Arellanes holds a bachelor's degree in Book Arts from the University of California, Santa Barbara. He also works as a translator from Czech to English, having translated such books as Tomas Sedlacek's “Economics of Good and Evil.” He has lived in Prague since 1992, and has been the host of a music show on Prague's Radio 1 since then."
777d7047-079c-e138-5a71-ec012fb2ef56,Jonathan Goody,person,jonathan-goody,https://www.crunchbase.com/person/jonathan-goody,472625.0,2016-12-01 07:57:26,2018-02-12 23:23:41,"Jonathan Goody has over 25 years of experience in managing sales teams providing services to banks, credit unions, retail establishments, healthcare companies, and technology firms. Prior to working with Ncontracts, Mr. Goody was Senior Vice President at BancVue Interactive; Managing Partner of the Goody Group; Director of Bank and Credit Union Sales for Politzer and Haney, Executive Vice President of Sales for Net Insurance, Senior Vice President of Sales for ebDirect, Senior Vice President of Sales for Private Business Inc., and National Sales Manager for Bieber Lighting Corporation. Jonathan also served on the board of Community Bank of the Bay from 2002 until 2011, where he was the Chairman of the Loan Committee and the Compensation Committee and was a member of the Audit, Alco and Technology Steering Committees. Jonathan is also a two term Civil Service Commissioner for the City of Piedmont California. He graduated from the University of Southern California with a B.S. from the Marshall School of Business with an emphasis in Entrepreneurship."
472bd047-1416-8df2-4307-6596c171ff24,Harris Naga Putra,person,harris-naga-putra,https://www.crunchbase.com/person/harris-naga-putra,297364.0,2016-12-30 09:03:51,2019-01-05 07:48:59,"Tech geeky, result-driven person. Strategic business and innovation thinking. Proven marketing and sales record. Social change and human rights philanthropist."
06668402-3ace-4a81-b8a7-c93e8ddb618c,Harry Travis,person,harry-travis,https://www.crunchbase.com/person/harry-travis,487190.0,2018-06-14 04:30:29,2018-06-14 04:30:40,"Travis is the President and CEO of etectRx, Inc.  etectRx has developed a novel wireless system that incorporates a tiny ingestible wireless transmitter/receiver into capsules to definitively, reliably, and safely indicate when a patient has taken their medicine Mr. Travis is an experienced senior executive with over 25 years experience in all aspects of pharmaceutical distribution channel management.  He has held senior leadership positions with Baxter Healthcare, Cardinal Health, Accredo/Medco and Aetna.  Most recently he held the position of Vice President of Aetna’s Specialty and Home-Delivery Pharmacy Business.  Aetna’s specialty pharmacy is ranked in the top five specialty pharmacies in the US. Harry holds a BS in Pharmacy from the University of Pittsburgh, School of Pharmacy, and an MBA from The Darden School at the University of Virginia."
235be0c7-f216-c97c-036e-66ea03bcba29,Jacqueline Zider,person,jacqueline-zider,https://www.crunchbase.com/person/jacqueline-zider,470080.0,2015-09-08 10:37:21,2018-02-12 23:42:19,"Jackie Zider joined HarbourVest in 2009. She left the Firm to attend business school and rejoined HarbourVest’s direct investment team in 2014 after completing her MBA. Jackie focuses on sourcing, reviewing, executing, and monitoring direct co-investments, primarily in the healthcare industry. She has played a key role on several deals including Advance Health, MedOptions, Sivantos (formerly Siemens Audiology Solutions), CareCentrix, and TriTech Software Systems. Additionally, she monitored and advised several direct portfolio companies including Acclaris, Nexidia, American Trailer Works (formerly PJ Trailers), and Xpressdocs. Jackie's previous experience includes three years with Morgan Stanley, where she was an investment banking analyst in the Global Power & Utility Group in New York and the Corporate Finance Group in San Francisco. Her prior experience also includes a position at McKesson Corporation.  She received an AB in Molecular Biology from Princeton University in 2006 and an MBA in Health Care Management (with honors) from the Wharton School at the University of Pennsylvania in 2014. Jackie speaks conversational Italian."
06074a38-0204-764f-3216-54b63e61003b,Anthony Wanger,person,anthony-wanger,https://www.crunchbase.com/person/anthony-wanger,141327.0,2011-04-05 12:51:34,2018-02-12 23:35:58,"Anthony Wanger serves as President of IO. In this capacity, Wanger directs the Company's expansion and acquisition activities, oversees key transactions and the Company's Legal, HR and Risk Management functions.  Anthony has lead IO's DCaaS expansion and development across the world.  Prior to his involvement with IO, Wanger co-founded and managed Sterling Network Services, LLC, a leading enterprise data center services provider.  Earlier in his career, Wanger was a private equity investor and served as Senior Vice President at Sterling Partners where he directed a variety of investments and transactions for the firm.  Wanger graduated with a Bachelor of Arts degree in Political Science from Emory University and a Juris Doctor degree from the Boston University School of Law."
c369b9da-7675-4581-a7ba-66a08dba702d,Guilherme Soubihe,person,guilherme-soubihe,https://www.crunchbase.com/person/guilherme-soubihe,709305.0,2019-02-28 14:07:13,2019-02-28 14:07:13,Guilherme Soubihe is CEO at Maxihost.
b2cd52e2-c95e-b122-86f5-84f6f364e546,Hongjiu Gao,person,hongjiu-gao,https://www.crunchbase.com/person/hongjiu-gao,359751.0,2014-02-14 15:56:07,2018-02-12 23:57:41,"Hongjiu Gao is the chief executive officer of Lvmama, a B2C e-tourism website in China."
d2a6759c-e898-dac2-7daf-a680baba333a,Matt McPherson,person,matt-mcpherson-2,https://www.crunchbase.com/person/matt-mcpherson-2,652612.0,2016-08-16 09:15:22,2018-02-12 23:57:48,"As Director of Operations, Matt is responsible for the day to day and strategic operational demands of the group.   Prior to this appointment Matt directed Wireless Logic’s strategic partnerships – key clients and all Mobile Network Operators (MNOs).  Matt has considerable business development and operational experience and brings vital customer and sales-focused skills to the operations role.    Matt joined the company from Nemesis GB, an automotive communications company, where he was Sales and Marketing Director."
220fe1c1-e0ee-42ec-a8a3-327c748147c8,Helen Ho,person,helen-ho,https://www.crunchbase.com/person/helen-ho,301318.0,2018-03-22 14:52:13,2018-03-22 14:52:13,"Helen Ho is Vice President, Head of Corporate Development at TCR2. "
e8f39fb1-0b50-c887-9151-66fb9d79800b,"Mark Getelman, MD",person,mark-getelman-md,https://www.crunchbase.com/person/mark-getelman-md,862901.0,2017-01-20 15:27:17,2018-02-12 23:58:19,"Dr. Mark Getelman is an orthopedic surgeon and sports medicine specialist at Southern California Orthopedic Institute located in the greater Van Nuys, Thousand Oaks and Los Angeles, California area. Dr. Getelman is consistently recommended by his peers and nurses and specializes in disorders of the shoulder and knee, as well as cartilage reconstruction and minimally invasive surgery. His treatment focuses include rotator cuff repair, arthroscopic glenoid augmentation, LATARJET reconstruction, pectoralis major repair, knee ligament reconstruction, failed ACL surgery and articular cartilage defects surgery.   Board certified by the American Board of Orthopaedic Surgeons, Dr. Getelman is a diplomat of the National Board of Medical Examiners, as well as a member of the American Academy of Orthopaedic Surgeons, Arthroscopy Association of North America, and American Orthopaedic Society for Sports Medicine.   Dr. Getelman, orthopedic surgeon and sports medicine specialist, serves as co-director of the Southern California Orthopedic Institute Sports Medicine Fellowship Program, and has participated in the training of over 50 orthopedic fellows. He is actively involved in orthopedic and sports medicine research and has published numerous articles on shoulder, knee and ankle topics and has written several textbook chapters.   Dr. Getelman is a graduate from Tulane University and the University of Florida College of Medicine and completed his orthopedic surgery residency at Boston University. Dr. Getelman spent one year as an orthopedic trauma fellow at Boston City Hospital and one year as a sports medicine and adult reconstructive surgery fellow at St. Elizabeth's Hospital before becoming an orthopedic surgeon and sports medicine specialist.   Dr. Mark Getelman was an associate team physician at Boston College and was the resident sports medicine director at Boston University from 1995 to 1996. Subsequently, he completed a one year fellowship in sports medicine and arthroscopic and reconstructive surgery at Southern California Orthopedic Institute."
86f1e1e2-46de-f5ba-896d-d7bb99389d2f,Nela Sotonova,person,nela-sotonova,https://www.crunchbase.com/person/nela-sotonova,395474.0,2012-11-11 06:11:31,2018-02-12 23:51:46,Co-Founder at  Designeros
c9652658-cb92-132d-b145-b64da88b66a2,Jacqueline Ros,person,jacqueline-ros,https://www.crunchbase.com/person/jacqueline-ros,131795.0,2015-05-11 09:50:51,2018-02-12 23:44:32,"As the CEO and founder of Revolar, Jacqueline has always held a passion for social issues that has led her to work as a Guardian ad Litem in Florida, as an intern with UNICEF, and most recently as a teacher for Teach For America in Aurora, CO. Previously, she worked as a Spanish as a Second Language Teacher at AXL Academy, and is currently on the Board of Directors for the nonprofit, Rise Beyond Dreams located in Denver, Colorado. She holds BA’s in both International Studies and Spanish from the University of Florida, where she graduated summa cum laude."
9c8b81a3-0948-6e37-979d-1ba09dc10b61,Oran Bar-Tal,person,oran-bar-tal,https://www.crunchbase.com/person/oran-bar-tal,677560.0,2015-01-03 07:39:23,2018-02-13 00:01:58,"Oran specializes in animation with 3 years of experience in producing projects and computer games. After working in television, web and even biotechnological 3d simulations, Oran’s main passion for games brought him to Adventure Mob in hope to create a successful world class gaming company in Isreal."
901dcfe2-84ff-4e6d-ad41-bb80fa5e4c55,Richard Askam,person,richard-askam,https://www.crunchbase.com/person/richard-askam,801628.0,2018-03-23 11:00:49,2018-09-08 03:44:30,Richard Askam is a renowned speaker/writer on how brands/consumers can engage with print through personalization/customization. He created the online Share a Coke campaign in Europe in 2014 along with a number of direct to consumer campaigns and now speaks all over the world (including TED) on the subject and what it really means.
75d8b4af-50e1-8526-da9d-c6d9240232d7,Aaron Graves,person,aaron-graves,https://www.crunchbase.com/person/aaron-graves,558655.0,2014-08-27 02:14:57,2018-02-12 22:28:23,I don't suffer fools gladly.
a646691a-0904-c647-bf95-efe1bf40e68c,Giancarlo De Lio,person,giancarlo-de-lio,https://www.crunchbase.com/person/giancarlo-de-lio,45203.0,2015-05-04 10:57:43,2018-02-12 23:50:23,Founder at VitalHub
388d9a4d-cbd1-4019-847a-16fbcabb6764,Adam Martinson,person,adam-martinson,https://www.crunchbase.com/person/adam-martinson,390835.0,2019-04-23 18:26:56,2019-04-25 13:39:12,"Adam Martinson co-founded HubH2O in September 2016, since which he has been serving as its chief executive officer."
d4a90c98-efcc-4e24-8603-cfef0ea73031,Äbeer Khalique,person,äbeer-khalique,https://www.crunchbase.com/person/äbeer-khalique,400138.0,2019-02-02 16:43:17,2019-02-02 16:57:21,Head of Design at Fugio and Founder of Studio Whir.
30706d44-348c-6e30-f421-277bc6fddb4c,Sertaç Yıldırım,person,sertaç-yıldırım,https://www.crunchbase.com/person/sertaç-yıldırım,873545.0,2015-04-07 04:32:45,2018-02-12 23:38:02,Founder at Birevision
26dfc2bd-1ef2-3c3b-e34b-7de42230a3b1,Anh Le Giang,person,le-giang-anh,https://www.crunchbase.com/person/le-giang-anh,100694.0,2014-08-27 08:43:59,2018-09-02 09:15:07,"Le Giang Anh is Founder at JOY Entertainment, later merged into Horus Entertainment. He is now the COO & CMO of Horus Entertainment"
6294a765-13de-4ecf-8efb-84919ecfeb4b,Liz Dawson,person,liz-dawson,https://www.crunchbase.com/person/liz-dawson,606794.0,2018-10-10 09:12:53,2018-10-10 09:13:44,Liz is an experienced policy manager at Smart Energy GB. She leads on Smart Energy GB’s work looking at the importance and benefits of smart meters and smart grids to the future of Great Britain’s cities and rural areas. She also manages the delivery of Smart Energy GB’s programmes aimed at engaging parliamentarians and local authorities with the national smart meter rollout. Liz has extensive experience of parliamentary and political engagement. Before joining Smart Energy GB Liz worked at the Industry and Parliament Trust where she ran the Fellowship programme which provides parliamentarians with a unique opportunity to gain first-hand experience of how business and industry operates
426684d7-d4ad-d43e-5d96-910946a8acdf,Kevin Fung,person,kevin-fung,https://www.crunchbase.com/person/kevin-fung,820812.0,2016-01-15 05:40:35,2018-02-13 00:40:48,Founder at Ally Funding.
6ddcb889-985b-e768-da7f-63fe4229d675,Chris Pawlik,person,chris-pawlik,https://www.crunchbase.com/person/chris-pawlik,154771.0,2015-07-14 05:34:53,2018-02-12 23:54:59,"Chris brings over a decade of broad based real estate and finance experience. Prior to founding EPR^2, he was an integral part of an institutional equity advisory team focused on West Coast assets.   He has also been responsible for Mid-West real estate acquisitions for a Private Capital group that acquired ~$2.0 billion of assets in 18 months. Chris holds a triple degree from UC Berkeley (Haas-BS Bus Admin, BA PEIS, and BA Slavic Lang & Lit)."
a6078cd2-ed25-9476-724c-e47e3835dbce,Cynthia Varela,person,cynthia-varela,https://www.crunchbase.com/person/cynthia-varela,392619.0,2017-07-28 05:20:13,2018-02-12 23:32:58,"Cynthia Varela is the founder of Briotech, Inc. She has worked alongside Dan Terry for the past 26 years, running Danterry, Inc. and in the start-up of Briotech. She has over 32 years of experience in administrative and business management operations. Her structured and supportive nature coupled with her enthusiastic and entrepreneurial spirit, have proven key success throughout her career and in running her own companies. Cynthia carries with her a keen sense of company vision for Briotech, and specializes in strategic and thoughtful carry-through of that vision through customer service."
2dc9b105-39d5-7c5d-6a27-25e06f557964,Christopher Monosmith,person,christopher-monosmith,https://www.crunchbase.com/person/christopher-monosmith,532382.0,2015-08-15 11:21:05,2018-02-12 23:39:48,"I've been a Software Engineer at Vertafore for almost six years, building Java web applications with a variety of technologies that now include DataStax Enterprise."
69d786c5-b234-7a99-3b7a-3b6e6ebf99a3,Timothy L Frost,person,timothy-l-frost,https://www.crunchbase.com/person/timothy-l-frost,703999.0,2016-09-20 05:28:13,2018-02-13 00:01:18,"Tim Frost joined BSI as Design Engineering Manager for the Chattanooga and Lewisburg manufacturing facilities in February of 1996. Since joining BSI, Mr. Frost has served as Sales Manager for Universal Tubular Systems, Sales Manager for the Gas Components Group, Vice President of the combined Sales and Product Development resources of the Gas Components Group, and is currently the Vice President for Global Product Development. In 2012, he was promoted to Chief Operating Officer bringing the design and manufacturing engineering under his leadership as well as operations and quality. Prior to joining BSI, Mr. Frost spent four years in the U.S. Army and one year as a Sales and Technical Representative for Southwestern Industries in Los Angeles, CA. Mr. Frost holds a B.S. in Mechanical Engineering Technology."
605ee1d3-76e2-d67e-053b-228423e365b0,Michael Carpenter,person,michael-carpenter,https://www.crunchbase.com/person/michael-carpenter,568300.0,2013-10-25 13:03:20,2018-02-12 23:57:12,"Member, Board of Directors at New York City Investment Fund."
b61e3e33-1ef2-24dd-3c37-a5a971785ed6,Jean-Charles Dupuis,person,jean-charles-dupuis,https://www.crunchbase.com/person/jean-charles-dupuis,412270.0,2009-01-26 01:44:55,2018-02-12 23:40:14,Jean-Charles has more than 30 years of experience mainly as an International Investment Banker and specialist of the NIT sector.  Jean-Charles worked  for 11 years in Germany and UK as Deputy Regional Manager. He has also been a Managing Director of HSBC investment banking in Paris.  Prior to joining Neocase Software as CFO Jean-Charles held the position of Director of Investment of CDC Kineon a VC owned by Caisse des Depots et Consignations dedicated to NIT.
208421b7-4a31-3f26-7459-e998acb94453,Jill Eisenhard,person,jill-eisenhard,https://www.crunchbase.com/person/jill-eisenhard,116917.0,2016-04-07 03:34:28,2018-02-12 23:29:07,"Jill Eisenhard is the Founder and Executive Director of Red Hook Initiative (RHI) in Red Hook, Brooklyn. Under her leadership RHI has developed a model for social change and youth development that empowers community members to become agents of change in their own lives and neighborhood. Prior to starting RHI, Ms. Eisenhard worked for five years with Long Island College Hospital and three years with the Children’s Aid Society.  Ms. Eisenhard and RHI received a Union Square Award (2007), Brooklyn Chamber of Commerce “Building Brooklyn Award” (2012),  and the NPCC Gold Medal for Excellence in Nonprofit Management (2012). In 2012 she received the Coro Alumni Leadership Award for Civic Engagement. She was featured in the July 2012 issue of More Magazine under their “Job Genius” series. In 2014 Ms. Eisenhard was named to Crain’s 40 under 40 and was a City & State Above and Beyond honoree. Ms. Eisenhard holds a BS from Cornell University."
e2b03438-8f0f-43a8-842e-ad914d862a71,Pankaj Patel,person,pankaj-patel-2a71,https://www.crunchbase.com/person/pankaj-patel-2a71,327017.0,2018-09-03 16:37:15,2018-09-03 16:37:15,"Pankaj Patel is Executive Vice President and Pharmacist-in-charge, and Co-Founder at Curant Health. Pankaj is one of the founding members of Curant Health. A graduate of the University of Houston Pharmacy School, he has been a practicing pharmacist for over 30 years. Along with the other founding members, Pankaj is focused on bringing to life his vision of creating a progressive medication management company. As medication usage has increased, healthcare has turned to pharmacists to manage complex drug regimens to resolve and prevent medication-related problems. Pankaj has been instrumental in Curant Health taking the lead in medication therapy management optimization to monitor and improve outcomes associated with chronic diseases states and to provide drug information consultations to healthcare providers."
